{
  "$schema": "https://ui.shadcn.com/schema/registry-item.json",
  "name": "reorder",
  "type": "registry:component",
  "title": "Reorder",
  "description": "A drag-to-reorder list where the displaced rows don't move together — each settles with a spring softened by its distance from the row you dragged, so the shift travels down the list as a wave.",
  "dependencies": ["motion"],
  "registryDependencies": ["z-spring", "z-cn"],
  "files": [
    { "path": "reorder.tsx", "type": "registry:component" }
  ],
  "meta": {
    "category": "input-utility",
    "states": ["idle", "dragging", "settling"],
    "spring": "snap"
  }
}
