{
  "$schema": "https://ui.shadcn.com/schema/registry-item.json",
  "name": "scrub",
  "type": "registry:component",
  "title": "Scrub",
  "description": "A seek bar whose precision increases as the pointer pulls away from the track.",
  "dependencies": ["motion"],
  "registryDependencies": ["use-controllable-state", "z-spring", "z-cn"],
  "files": [
    { "path": "scrub.tsx", "type": "registry:component" }
  ],
  "meta": {
    "category": "input-utility",
    "states": ["idle", "hover", "scrubbing", "scrubbing-fine", "settling"],
    "spring": "settle"
  }
}
