{
  "$schema": "https://ui.shadcn.com/schema/registry-item.json",
  "name": "use-controllable-state",
  "type": "registry:hook",
  "title": "Use Controllable State",
  "description": "State that is uncontrolled by default and controlled when a value is passed.",
  "dependencies": [],
  "registryDependencies": [],
  "files": [
    { "path": "use-controllable-state.ts", "type": "registry:hook" }
  ],
  "meta": {
    "category": "primitive"
  }
}
