{
  "$schema": "https://ui.shadcn.com/schema/registry-item.json",
  "name": "scheduler",
  "type": "registry:component",
  "title": "Scheduler",
  "description": "A date-and-time booking picker where hovering a slot raises a dim, question-marked preview of the confirmation before you've committed to anything, and month navigation is an interruptible spring, not a crossfade.",
  "dependencies": ["motion"],
  "registryDependencies": ["use-controllable-state", "z-spring", "z-cn"],
  "files": [
    { "path": "scheduler.tsx", "type": "registry:component" }
  ],
  "meta": {
    "category": "input-utility",
    "states": ["browsing", "previewing", "committed"],
    "spring": "settle"
  }
}
