{
  "$schema": "https://ui.shadcn.com/schema/registry-item.json",
  "name": "z-spring",
  "type": "registry:lib",
  "title": "Z Spring",
  "description": "The Z-UI spring scale and the transition hook that honors prefers-reduced-motion.",
  "dependencies": ["motion"],
  "registryDependencies": [],
  "files": [
    { "path": "z-spring.ts", "type": "registry:lib" }
  ],
  "meta": {
    "category": "primitive"
  }
}
