{
  "$schema": "https://ui.shadcn.com/schema/registry-item.json",
  "name": "undo-toast",
  "type": "registry:component",
  "title": "Undo Toast",
  "description": "A destructive action's grace period, with a visible clock that pauses when you reach for it.",
  "dependencies": ["motion"],
  "registryDependencies": ["z-spring", "z-cn"],
  "files": [
    { "path": "undo-toast.tsx", "type": "registry:component" }
  ],
  "meta": {
    "category": "input-utility",
    "states": ["counting", "held", "dragging", "leaving"],
    "spring": "settle"
  }
}
